title,price,rating,reviews,availabillity
QUOKKA Family Board Game for Kids and Adults - Fun Party Card Game for Teens 8-12 - Funny Bears Theme | 108 Cards | Fast-Paced | Easy to Learn | Highly Replayable - 2+ Players Game Night,,4.4 out of 5 stars,68 ratings,In Stock
QUOKKA Geography Board Game for Kids 8-12 - USA Learning Family Game for Teens & Adults - | 120 Question Cards | Top Facts | Play Indoor & Outdoor | - Educational United States Toy 6 10 Year Olds,,4.5 out of 5 stars,74 ratings,In Stock
QUOKKA Fun Board Game for 8 10 Year Olds - Family Card Game for Kids Ages 6 7 & Adults - Who Knows Me Better | Guess Questions | Easy to Learn - Get to Know Your Friends & Family,,4.5 out of 5 stars,"1,428 ratings",In Stock
"Queensell Dominos Set for Adults – Dominoes - Classic Board Games, Double 6 Dominoes Family Games for Kids and Adults - Double Six Standard Dominos Set 28 Tiles with Wood Case, Juegos de Mesa",,4.6 out of 5 stars,"2,409 ratings",In Stock
OUTSMARTED! The Live Family Quiz Show Board Game | Ages 8+ | for 2 to 24 Players 2023 Edition,,4.3 out of 5 stars,"2,656 ratings",In Stock
"Upwords, Word Game with Stackable Letter Tiles & Rotating Game Board, New 2023 Version | Games for Family Game Night | Family Games, for Adults and Kids Ages 8 and up",,4.7 out of 5 stars,"2,692 ratings",In Stock
"Hasbro Gaming Connect 4 Classic Grid,4 in a Row Game,Strategy Board Games for Kids,2 Player .for Family and Kids,Ages 6 and Up",,4.8 out of 5 stars,"75,660 ratings",In Stock
Hasbro Gaming Sorry! Game,,4.8 out of 5 stars,"29,825 ratings",In Stock
Hasbro Gaming Candy Land Kingdom Of Sweet Adventures Board Game For Kids Ages 3 & Up (Amazon Exclusive),,4.8 out of 5 stars,"33,723 ratings",In Stock
"The Uzzle 3.0 Board Game, Family Board Games for Children & Adults, Block Puzzle Games for Ages 4+",,4.6 out of 5 stars,"2,065 ratings",In Stock
Hasbro Gaming Chutes and Ladders Board Game for 2 to 4 Players Kids Ages 3 and Up (Amazon Exclusive),,4.8 out of 5 stars,"11,167 ratings",In Stock
Hasbro Gaming Connect 4 Strategy Board Game for Ages 6 and Up (Amazon Exclusive),,4.8 out of 5 stars,"18,110 ratings",In Stock
Hasbro Gaming Trouble Board Game for Kids Ages 5 and Up 2-4 Players (Packaging may vary),,4.7 out of 5 stars,"35,535 ratings",In Stock
"Mattel Games Pictionary Board Game, Drawing Game for Kids, Adults and Game Night, Unique Catch-All Category for 2 Teams (Amazon Exclusive)",,4.6 out of 5 stars,"6,548 ratings",In Stock
"SANFENSUGAR 48 Pcs Tetra Tower Game, Balance Stacking Blocks Board Games for Kids & Adults, Team Building Games Toy for 2 Players Party Family Travel",,4.3 out of 5 stars,54 ratings,In Stock
QUOKKA Board Game for 8-12 Year Olds - Family Card Game for Kids Ages 6-8 - What Would You Choose | Do Kids Rather? | Pick Your Answer | Get to Know You - Fun Game Night for Boys & Girls,,4.5 out of 5 stars,199 ratings,In Stock
"Spontuneous The Worst-CASE Scenario Card Game - All New Family/Party Game | 0% Trivia, 100% Humorous Fun",,4.6 out of 5 stars,467 ratings,In Stock
QUOKKA Family Board Games for Kids 8-12 - Party Game for Kids & Adults Game Night - Fast Paced | Easy to Learn | 2-7 Players - Card Game for Teen Boys and Girls Ages 6 7 10 Year Olds,,4.6 out of 5 stars,419 ratings,In Stock
"Hasbro Gaming Scrabble Board Game,Word Game for Kids Ages 8 and Up,Fun Family Game for 2-4 Players,The Classic Crossword Game",,4.8 out of 5 stars,"2,728 ratings",In Stock
Board Games for Family Night Adults & Kids - Elevate Game Night For All Ages 6 & Up Best For Groups And Get Togethers This Fun Crazy Charades Style Game Will Have You Laughing Till Your Cheeks Hurt,,4.5 out of 5 stars,20 ratings,In Stock
"Jumanji Deluxe Game, Immersive Electronic Version of The Classic Adventure Movie Board Game, with Lights and Sounds, Family Game Night Game for Kids & Adults Ages 8 and up",,4.6 out of 5 stars,"3,291 ratings",In Stock
"Hasbro Gaming Sorry! Family Board Games for Kids and Adults, 2 to 4 Players, Ages 6 and Up (Amazon Exclusive)",,4.8 out of 5 stars,"2,781 ratings",In Stock
"Nicecho Shut The Box Dice Game,2-4 Player Family Wooden Board Table Math Games for Adults and Kids, 8 Dices Classics Tabletop Version Games for Classroom,Home,Party or Pub",,4.4 out of 5 stars,725 ratings,In Stock
Glintoper Tic Tac Toe & 4 in a Row Table Games Set - Rustic Decor Wood Strategy Board Games for Families,,4.5 out of 5 stars,"2,122 ratings",In Stock
QUOKKA Family Conversation Cards - Icebreaking Talking Topics Board Game for Kids 8-10 Year Olds - Getting to Know You | 500 Fun Questions | Answer in 1 Min - Family Game Night with Teens & Adults,,4.5 out of 5 stars,82 ratings,In Stock
"Hasbro Gaming Wordle The Party Game for 2-4 Players, Official Wordle Board Game Inspired by New York Times, Games for Ages 14+, Word Games",,4.4 out of 5 stars,"1,666 ratings",In Stock
"15'' Wooden Chess Set | Folding Board, 2 Extra Queens | Magnetic Chess Board Set for Adults & Kids, Pieces Storage Slots Checkers Game for Kids Portable Travel Chess Game for Beginner",,4.3 out of 5 stars,32 ratings,In Stock
"Pressman Charades for Kids - The 'No Reading Required' Family Game, 5""",,4.7 out of 5 stars,"9,920 ratings",In Stock
"Hasbro Gaming Clue Board Game for Kids Ages 8 and Up, Reimagined Clue Game for 2-6 Players, Mystery Games, Detective Games, Family Games for Kids and Adults",,4.7 out of 5 stars,685 ratings,In Stock
"Mattel Games UNO Card Game for Family Night, Travel Game & Gift for Kids in a Collectible Storage Tin for 2-10 Players (Amazon Exclusive)",,4.8 out of 5 stars,"74,871 ratings",In Stock
"Hasbro Gaming Jenga Classic Game with Genuine Hardwood Blocks,Stacking Tower Game for 1 or More Players,Kids Ages 6 and Up",,4.8 out of 5 stars,"96,908 ratings",In Stock
"Hasbro Twister Party Classic Board Game for 2 or More Players,Indoor and Outdoor Game for Kids 6 and Up,Packaging May Vary",,4.7 out of 5 stars,"12,285 ratings",In Stock
"2024 Newest Magnetic Chess Game, Checkers Board Game,Magnetic Effect Chess Set Battle Chess, Educational Checkers Game for Kids & Adults, Family Gatherings",,4.4 out of 5 stars,23 ratings,In Stock
"Hasbro Gaming Guess Who? Board Game, with People and Pets Cards, The Original Guessing Game for Kids, Ages 6 and Up (Amazon Exclusive)",,4.6 out of 5 stars,"5,111 ratings",In Stock
Hasbro Gaming Sorry! Game,,4.8 out of 5 stars,"29,825 ratings",In Stock
"ALMCALS 32 PCS Tetra Tower Game, Stacking Blocks Building Balance Board Games for Kids & Adults - 2+ Player Family Games, Parties, Travel, Team, Friends",,4.8 out of 5 stars,13 ratings,In Stock
WHAT DO YOU MEME? Family Edition - The Best in Family Card Games for Kids and Adults,,4.6 out of 5 stars,"18,511 ratings",In Stock
"The Uzzle 3.0 Board Game, Family Board Games for Children & Adults, Block Puzzle Games for Ages 4+",,4.6 out of 5 stars,"2,065 ratings",In Stock
"Magnetic Chess Game - 2024 New Family Board Games Set for Kids and Adults, Tabletop Board Games for 2 Person, Fun Table Top Magnet Chess Game with Magnetic Chess Rocks Set",,4.5 out of 5 stars,77 ratings,In Stock
"Hedbanz 2023 Edition Cards Picture Guessing Board Game- Family Games, Games for Family Game Night, Kids Games, Card Games for Families & Kids Ages 6 and Up",,4.7 out of 5 stars,"9,606 ratings",In Stock
"Giant Sorry Classic Family Board Game Indoor Outdoor Retro Party Activity Summer Toy with Oversized Gameboard, for Adults and Kids Ages 6 and up",,4.6 out of 5 stars,"5,046 ratings",In Stock
"Hasbro Gaming Trivial Pursuit Game: Family Edition Board Game, Family Trivia Games for Adults and Kids, 2+ Players, Ages 8+ (Amazon Exclusive)",,4.7 out of 5 stars,"6,706 ratings",In Stock
"Wooden Mancala Board Game Set,Larger Size Mancale Instructions, Portable Travel Board Game for Kids and Adults",,4.3 out of 5 stars,4 ratings,In Stock
"Minute of Fun Party Game - Amazing, 237 Minute to Win It Challenges for Duels, Teams, Parties - Teens, Family, Friends, Party Games, Kids, Adults. for Home, Scout Games, School, Travel. 2-12 Players.",,4.4 out of 5 stars,"2,126 ratings",In Stock
Kids VS Parents - Family Game for Kids 4-12 | Games for Family Game Night | Kids Card Games with 200 Conversation Starter Cards for 10-90 Minutes Play Time,,4.6 out of 5 stars,865 ratings,In Stock
"Beat The Parents Classic Family Trivia Game, Kids Vs Parents, with 25 Bonus Cards for Ages 6 and up (Amazon Exclusive)",,4.6 out of 5 stars,"2,156 ratings",In Stock
"Regal Games Mancala Board Game - Fun Classic Table Game with Wooden Board for Adults & Kids - 48 Glass Mancala Beads & 2 Player Games - Ideal for Family Game Night, Travel (Ages 8+)",,4.7 out of 5 stars,"2,600 ratings",In Stock
Wack A Balloon Strategy Board Game | Family Game Night Favorite | Engaging For Kids And Adults | Play Solo Or Challenge Friends | Popular Social Media Games Everyone Can Play | Ages 4+,,5.0 out of 5 stars,7 ratings,In Stock
"Hasbro Gaming Scrabble Board Game,Word Game for Kids Ages 8 and Up,Fun Family Game for 2-4 Players,The Classic Crossword Game",,4.8 out of 5 stars,"2,728 ratings",In Stock
"Spoons in a Case, Spoons Game, Family Games for Kids and Adults, Travel Game, Fun Games for Family Game Night, Card Games for Kids, Board Games for Kids 8-12, Kids Games Ages 8-12, Games for Adults",,4.6 out of 5 stars,"5,275 ratings",In Stock
"Do You Really Know Your Family? A Fun Family Game Filled with Conversation Starters and Challenges - Great for Kids, Teens and Adults",,4.6 out of 5 stars,"13,110 ratings",In Stock
"CERBONNY 32 Pcs Tetra Tower Balance Stacking Game, Board Game for 2+ Players Family Games, Parties, Travel Kids & Adults Toys",,4.6 out of 5 stars,271 ratings,In Stock
Inspiration Play Double Ditto - a Hilarious Award-Winning Family Party Game,,4.7 out of 5 stars,"5,102 ratings",In Stock
Lucky Dog Dice Game - Family Fun for Ages 8+ | Engaging Multi-Mode Play for 1-4 Players | Dog-Themed Strategy & Laughter | Board Game for Kids&Adults,,4.8 out of 5 stars,27 ratings,In Stock
QUOKKA Family Board Games for Kids 8-12 - Party Game for Kids & Adults Game Night - Fast Paced | Easy to Learn | 2-7 Players - Card Game for Teen Boys and Girls Ages 6 7 10 Year Olds,,4.6 out of 5 stars,419 ratings,In Stock
"Multipurpose Go 50 Pcs Board Games for Kids & Adults Tetra Tower Balance Stacking Toys Perfect for Family Games, Parties, Travel",,4.6 out of 5 stars,12 ratings,In Stock
"Cash 'N Guns Second Edition Party,Money Heist Strategy Board Game | Bluffing Gangster Game for Adults and Kids | Ages 10+| 4-8 Players | Average Playtime 30 Minutes | Made by Repos Production",,4.7 out of 5 stars,"1,451 ratings",Usually ships within 2 to 3 days
"3-in-1 Vintage Giant Checkers and Tic Tac Toe Game with Reversible Mat, 24 Chips, Family Board Game, Lawn Game, BBQ Party Favor, Indoor and Outdoor Activity for Kids and Adults",,4.6 out of 5 stars,678 ratings,In Stock
TOMY Pop Up Pirate Board Game - Swashbuckling Kids Games for Family Game Night - Kids Activities and Pirate Accessories - Family Board Games for Kids Ages 4 and Up,,4.4 out of 5 stars,"57,569 ratings",In Stock
Vango UpsideDownChallenge Game for Kids & Family - Complete Fun Challenges with Upside Down Goggles - Hilarious Game for Game Night and Parties - Ages 8+,,4.6 out of 5 stars,"7,500 ratings",In Stock
Hasbro Gaming Candy Land Kingdom Of Sweet Adventures Board Game For Kids Ages 3 & Up (Amazon Exclusive),,4.8 out of 5 stars,"33,723 ratings",In Stock
CATAN Junior Board Game | Civilization Building Strategy Game | Adventure Game | Fun Family Game for Kids and Adults | Ages 6+ | 2-4 Players | Average Playtime 30 Minutes | Made by CATAN Studio,,4.8 out of 5 stars,"4,415 ratings",In Stock
"AMEROUS Wooden Mancala Board Game Set - Folding Board - 72+8 Bonus Multi Color Glass Stones - Gift Package - Mancale Instructions, Portable Travel Board Game for Kids and Adults",,4.8 out of 5 stars,728 ratings,In Stock
Gutter Games Beat That! - The Bonkers Battle of Wacky Challenges [Family Party Game for Kids & Adults],,4.6 out of 5 stars,"20,707 ratings",In Stock
"Skillmatics Board Game Rapid Rumble, Fun for Family Game Night, Educational Toy, Card Game for Kids, Teens & Adults, Gifts for Ages 6, 7, 8, 9 and Up",,4.6 out of 5 stars,"2,311 ratings",In Stock
